{
  "packet_id": "openai-0.28.1-1.0.0",
  "package": "openai",
  "ecosystem": "pypi",
  "from_version": "0.28.1",
  "to_version": "1.0.0",
  "sources": [
    {
      "url": "https://github.com/openai/openai-python/discussions/742",
      "kind": "docs"
    }
  ],
  "notes": "Structural openai 0.28 → 1.x kill-bar packet for demo-consumer.\n\nFrom the v1.0.0 migration (discussion 742): ChatCompletion.create → openai.chat.completions.create, the documented module-level client, plus DEPENDENCY_BUMP 0.28.1 → 1.0.0. Client-chain polish (OpenAI() + client.*) runs in `conduit run`.",
  "rules": [
    {
      "type": "AST_CALL_REWRITE",
      "target_files": ["*.py"],
      "old_callee": "openai.ChatCompletion.create",
      "new_callee": "openai.chat.completions.create",
      "reason": "v1.0.0 migration (discussion 742): openai.ChatCompletion.create() becomes the module-level openai.chat.completions.create. Client-chain polish then installs OpenAI()."
    },
    {
      "type": "AST_CALL_REWRITE",
      "target_files": ["*.py"],
      "old_callee": "ChatCompletion.create",
      "new_callee": "openai.chat.completions.create",
      "reason": "Bare ChatCompletion.create follows the same v1.0.0 rename to openai.chat.completions.create."
    },
    {
      "type": "DEPENDENCY_BUMP",
      "package": "openai",
      "from_version": "0.28.1",
      "to_version": "1.0.0",
      "ecosystems": ["pip", "pyproject"],
      "reason": "Major SDK bump required for the modern OpenAI Python client."
    }
  ]
}
